{"dataset_revision":"5b22c203248b0149cd0456f77d32feb887f48ee0","dataset_terms":"not established: compiled from third-party market sources (souba-db _meta.sources); fetched into a local cache, never vendored","horizon_revision":"c824cbe61a383e57f1d9d15fea962a79f5b6bbd5","known_gaps":["raw set-2 call bodies are not public","the estimate B's audit names (its fixture_sha256) is not public","acceptance records of the live run are not public"],"license":{"applies_to":"every vendored file (Horizon Shield repository LICENSE)","role":"license","spdx":"MIT"},"required_occurrences":["hs51-musubi-2-B"],"schema":"remora-h55-inputs-lock-v1","sources":[{"bytes":1101,"local_path":"pilot51/set2/audit_B.json","revision":"c824cbe61a383e57f1d9d15fea962a79f5b6bbd5","role":"set2_audit_b","sha256":"40bc2a46f428b2cc5000e9d5e896adac218ebe3c2b76f78ba29afebf97887aea","upstream_path":"workers/hs-ledger/nenrin/musubi-v0/ca2a-companion-v0/pilot51/set2/audit_B.json","vendored":true}],"upstream_repository":"https://github.com/ogasurfproject-jpg/horizon-shield"}
