{"dataset_revision":"5b22c203248b0149cd0456f77d32feb887f48ee0","dataset_terms":"not established: compiled from third-party market sources (souba-db _meta.sources); fetched into a local cache, never vendored","horizon_revision":"b85029de8d22c5246886f4f50ede03da0f54dfcf","known_gaps":["raw set-2 call bodies are not public","the audit bytes for B are not public","acceptance records of the live run are not public"],"license":{"applies_to":"every vendored file (Horizon Shield repository LICENSE)","role":"license","spdx":"MIT"},"required_occurrences":["hs51-musubi-2-A","hs51-musubi-2-B","hs51-musubi-2-C"],"schema":"remora-h55-inputs-lock-v1","sources":[{"bytes":1107,"local_path":"LICENSE","revision":"b85029de8d22c5246886f4f50ede03da0f54dfcf","role":"license","sha256":"fb64e419d1d94dfa6afc2927c35bbe577627701cd9fae4ca139483d5e2bec72d","upstream_path":"LICENSE","vendored":true},{"bytes":2195,"local_path":"pilot51/set2/README.md","revision":"b85029de8d22c5246886f4f50ede03da0f54dfcf","role":"set2_readme","sha256":"51b6be081da309fb82ecd295ceb7bb3df364b350a5b9e686dba99766af8b4a60","upstream_path":"workers/hs-ledger/nenrin/musubi-v0/ca2a-companion-v0/pilot51/set2/README.md","vendored":true},{"bytes":1873,"local_path":"pilot51/set2/SHA256SUMS","revision":"b85029de8d22c5246886f4f50ede03da0f54dfcf","role":"set2_sha256sums","sha256":"53b4ddb5b6a9c9908ef02e9d0d47717d7bc779171bb2611b664bc21ac1b93fdd","upstream_path":"workers/hs-ledger/nenrin/musubi-v0/ca2a-companion-v0/pilot51/set2/SHA256SUMS","vendored":true},{"bytes":115084,"local_path":"pilot51/set2/bundle.json","revision":"b85029de8d22c5246886f4f50ede03da0f54dfcf","role":"set2_bundle","sha256":"c4ecb8830a69f4a8e8c31f5c8d4c32460651d1cf63cabf77db08a7a4a62a3668","upstream_path":"workers/hs-ledger/nenrin/musubi-v0/ca2a-companion-v0/pilot51/set2/bundle.json","vendored":true},{"bytes":8593,"local_path":"pilot51/set2/settlement.json","revision":"b85029de8d22c5246886f4f50ede03da0f54dfcf","role":"reference_settlement","sha256":"565acd9cec6772c0c44bbff3cad1c71ed1c3c106c1448cbe37ae3c641b947d19","upstream_path":"workers/hs-ledger/nenrin/musubi-v0/ca2a-companion-v0/pilot51/set2/settlement.json","vendored":true},{"bytes":401,"local_path":"pilot51/set2/log/checkpoint.json","revision":"b85029de8d22c5246886f4f50ede03da0f54dfcf","role":"log_checkpoint","sha256":"afd5d289c7a289083be56849a73b9f9bef51877c9d6122cf507a6a1ca6115e31","upstream_path":"workers/hs-ledger/nenrin/musubi-v0/ca2a-companion-v0/pilot51/set2/log/checkpoint.json","vendored":true},{"bytes":401,"local_path":"pilot51/set2/log/checkpoint.stamp","revision":"b85029de8d22c5246886f4f50ede03da0f54dfcf","role":"log_checkpoint_stamp","sha256":"afd5d289c7a289083be56849a73b9f9bef51877c9d6122cf507a6a1ca6115e31","upstream_path":"workers/hs-ledger/nenrin/musubi-v0/ca2a-companion-v0/pilot51/set2/log/checkpoint.stamp","vendored":true},{"bytes":3017,"local_path":"pilot51/set2/log/checkpoint.stamp.ots","revision":"b85029de8d22c5246886f4f50ede03da0f54dfcf","role":"log_checkpoint_ots","sha256":"77e0b7aee9ff39224fa0c2963e540d1ddaa7e3e04f2c95f5f0ac9c08a64aa9b7","upstream_path":"workers/hs-ledger/nenrin/musubi-v0/ca2a-companion-v0/pilot51/set2/log/checkpoint.stamp.ots","vendored":true},{"bytes":14645,"local_path":"pilot51/set2/log/entries.jsonl","revision":"b85029de8d22c5246886f4f50ede03da0f54dfcf","role":"log_entries_jsonl","sha256":"a65b44a4d5c252aa1c0578737866b91e14cecf3503d3f31f4fe6d2f3af358406","upstream_path":"workers/hs-ledger/nenrin/musubi-v0/ca2a-companion-v0/pilot51/set2/log/entries.jsonl","vendored":true},{"bytes":739,"local_path":"pilot51/set2/log/entries/000_budget.json","revision":"b85029de8d22c5246886f4f50ede03da0f54dfcf","role":"log_entry_000_budget","sha256":"6c627d368f522c796d12a3ad38234e4b9de22f59c30010fd3fc4b7bdba03fabc","upstream_path":"workers/hs-ledger/nenrin/musubi-v0/ca2a-companion-v0/pilot51/set2/log/entries/000_budget.json","vendored":true},{"bytes":1024,"local_path":"pilot51/set2/log/entries/001_criteria_A.json","revision":"b85029de8d22c5246886f4f50ede03da0f54dfcf","role":"log_entry_001_criteria_A","sha256":"436624f3c804ab763a23170948aa6aa8905b8d60fb7904855fada377fdc26853","upstream_path":"workers/hs-ledger/nenrin/musubi-v0/ca2a-companion-v0/pilot51/set2/log/entries/001_criteria_A.json","vendored":true},{"bytes":1024,"local_path":"pilot51/set2/log/entries/002_criteria_B.json","revision":"b85029de8d22c5246886f4f50ede03da0f54dfcf","role":"log_entry_002_criteria_B","sha256":"26dff5978799083855ebe699d7ef07d2b44fe5bb12c122315badd016e7a5cc3a","upstream_path":"workers/hs-ledger/nenrin/musubi-v0/ca2a-companion-v0/pilot51/set2/log/entries/002_criteria_B.json","vendored":true},{"bytes":1024,"local_path":"pilot51/set2/log/entries/003_criteria_C.json","revision":"b85029de8d22c5246886f4f50ede03da0f54dfcf","role":"log_entry_003_criteria_C","sha256":"4ad98a413f8de0bae6ed6cb3c75ee031a9079af13b1f33caba0607e691285e14","upstream_path":"workers/hs-ledger/nenrin/musubi-v0/ca2a-companion-v0/pilot51/set2/log/entries/003_criteria_C.json","vendored":true},{"bytes":1227,"local_path":"pilot51/set2/log/entries/004_use_A.json","revision":"b85029de8d22c5246886f4f50ede03da0f54dfcf","role":"log_entry_004_use_A","sha256":"b2235a419754c244cbdba990a568f43145920be5d733fc072f6ec9bc5713c4e4","upstream_path":"workers/hs-ledger/nenrin/musubi-v0/ca2a-companion-v0/pilot51/set2/log/entries/004_use_A.json","vendored":true},{"bytes":1177,"local_path":"pilot51/set2/log/entries/005_payment_A.json","revision":"b85029de8d22c5246886f4f50ede03da0f54dfcf","role":"log_entry_005_payment_A","sha256":"68d9df8c7fc40375f6085ec3984ed5938d3f67ccf744583e27461734ea8418d1","upstream_path":"workers/hs-ledger/nenrin/musubi-v0/ca2a-companion-v0/pilot51/set2/log/entries/005_payment_A.json","vendored":true},{"bytes":1202,"local_path":"pilot51/set2/log/entries/006_receipt_A.json","revision":"b85029de8d22c5246886f4f50ede03da0f54dfcf","role":"log_entry_006_receipt_A","sha256":"75cf9584536caf8326a9f2ad968f415a0b1ea0c86d4ee7d857ded01a88f03f3d","upstream_path":"workers/hs-ledger/nenrin/musubi-v0/ca2a-companion-v0/pilot51/set2/log/entries/006_receipt_A.json","vendored":true},{"bytes":1227,"local_path":"pilot51/set2/log/entries/007_use_B.json","revision":"b85029de8d22c5246886f4f50ede03da0f54dfcf","role":"log_entry_007_use_B","sha256":"154bfccf555262b6c575b389d6838edb82dca7d2b6740eefa9143be6e670a470","upstream_path":"workers/hs-ledger/nenrin/musubi-v0/ca2a-companion-v0/pilot51/set2/log/entries/007_use_B.json","vendored":true},{"bytes":1177,"local_path":"pilot51/set2/log/entries/008_payment_B.json","revision":"b85029de8d22c5246886f4f50ede03da0f54dfcf","role":"log_entry_008_payment_B","sha256":"a20489646d7b5906db1fdd7a30d0be0b451752afa6bf8d1afef0d3369c99d53e","upstream_path":"workers/hs-ledger/nenrin/musubi-v0/ca2a-companion-v0/pilot51/set2/log/entries/008_payment_B.json","vendored":true},{"bytes":1202,"local_path":"pilot51/set2/log/entries/009_receipt_B.json","revision":"b85029de8d22c5246886f4f50ede03da0f54dfcf","role":"log_entry_009_receipt_B","sha256":"5e28e5866cbe2cbc7c4447f286e934c70b6c8dfbb80f719ce3be1c1560db311b","upstream_path":"workers/hs-ledger/nenrin/musubi-v0/ca2a-companion-v0/pilot51/set2/log/entries/009_receipt_B.json","vendored":true},{"bytes":1228,"local_path":"pilot51/set2/log/entries/010_use_C.json","revision":"b85029de8d22c5246886f4f50ede03da0f54dfcf","role":"log_entry_010_use_C","sha256":"c198c77ac3aa3664662b507369fa6a0cabb1d5ab189038a1c0c8c6fc3f819079","upstream_path":"workers/hs-ledger/nenrin/musubi-v0/ca2a-companion-v0/pilot51/set2/log/entries/010_use_C.json","vendored":true},{"bytes":1178,"local_path":"pilot51/set2/log/entries/011_payment_C.json","revision":"b85029de8d22c5246886f4f50ede03da0f54dfcf","role":"log_entry_011_payment_C","sha256":"3a4eaa6b730ad13ff05116dec0e7dc5e3df5d894df4770f99d78ad41e378302e","upstream_path":"workers/hs-ledger/nenrin/musubi-v0/ca2a-companion-v0/pilot51/set2/log/entries/011_payment_C.json","vendored":true},{"bytes":1203,"local_path":"pilot51/set2/log/entries/012_receipt_C.json","revision":"b85029de8d22c5246886f4f50ede03da0f54dfcf","role":"log_entry_012_receipt_C","sha256":"746eba10245043374a7845e40877685568f724b268e83de4a9fb9c7bf075f823","upstream_path":"workers/hs-ledger/nenrin/musubi-v0/ca2a-companion-v0/pilot51/set2/log/entries/012_receipt_C.json","vendored":true},{"bytes":1532,"local_path":"rehearsal/live_smoke/audit.json","revision":"b85029de8d22c5246886f4f50ede03da0f54dfcf","role":"public_ac_audit","sha256":"c2920477d95a8e48f16cc2df49ec58a02cd9b422db491206446e7a5be21937f5","upstream_path":"workers/hs-ledger/nenrin/musubi-v0/ca2a-companion-v0/rehearsal/live_smoke/audit.json","vendored":true},{"bytes":271,"local_path":"rehearsal/fixture.json","revision":"b85029de8d22c5246886f4f50ede03da0f54dfcf","role":"original_fixture","sha256":"c2ed811e1d4beb9ae528abc1dfa15a540af9ec5707f56344d8e58cb552ffc581","upstream_path":"workers/hs-ledger/nenrin/musubi-v0/ca2a-companion-v0/rehearsal/fixture.json","vendored":true},{"bytes":117282,"local_path":"souba-db.json","revision":"5b22c203248b0149cd0456f77d32feb887f48ee0","role":"dataset_souba_db","sha256":"7b16600e50ed73b844ff5b2718f04a6dd4d9ace0367982fb8d139db509d023fd","upstream_path":"data/souba-db.json","vendored":false}],"upstream_repository":"https://github.com/ogasurfproject-jpg/horizon-shield"}
